"job_id","job_title","job_description","company_id","company_name","job_url","job_location","company_size","founded_year","company_sector","country"
"1009293279864","University Graduate Software Engineering Focus Track fmd ","University Graduate Software Engineering Focus Track 100 fmd At Julius Baer we celebrate and value the individual qualities you bring enabling you to be impactful to be entrepreneurial to be empowered and to create value beyond wealth . Let us shape the future of wealth management together . We are looking for talented University Graduates Kickstart your career with our Software Engineering FocusTrack Graduate Programme within Information Technology Asia . Our Graduate Programme supports your individual journey to unleash your full potential . We offer you three rotations in different teams on and offthejob training and the opportunity to start building your own network . Each rotation is designed to provide you with indepth knowledge and a sound foundation to perform in your focus area and beyond . One of these rotations will be an international assignment enabling you to work abroad for a period of months . Start date 1 October 2024 Programme duration 18 months Join the Information Technology Asia team in the Software Engineering focus track in Singapore where you will gain exposure and learn the business of private banking and the latest technologies . You could also be part of the Banks DevOps transformation journey . Our programme will provide you with a firsthand experience in various areas such as Application Development Architecture and Platform Engineering across the span of 18 months including a 4month assignment in Switzerland . You will develop the skills to take your career in any direction and make a genuine contribution to our businesses . Let us shape the future of wealth management together . Join us . Be Bar . Curious to find out more about our Graduate Programme Check out our Careers website www . juliusbaer . comencareersgraduates and join us YOUR CHALLENGE Get involved with Frontend development for mobile web applications Take on Microservicebased API development Leverage Testdriven development Behaviordriven development automation frameworks . Work in a global agile team with DevOps tools frameworks and processes Learn about container platforms and cloud architecture YOUR PROFILE Bachelors or masters degree from a university or university of applied sciences with aboveaverage grades in computer sciences economics banking finance graduation max . 12 months ago Strong analytical conceptual skills and fast thinker Excellent communication and presentation skills Independent resilient and teamoriented personality Entrepreneurial mindset coupled with the willingness to take responsibility Eligible for employment authorization in Singapore Applications will be considered until 14 March 2024 . The review process will take some time . We thank you for applying early and for your patience . We are looking forward to receiving your full job application through our online application tool . Further interesting job opportunities can be found on our Career site . Is this not quite what you are looking for Set up a job alert by creating a candidate account here . Job ID r12692","12799","Julius Baer Group","https://www.glassdoor.com/partner/jobListing.htm?pos=102&ao=1136043&s=58&guid=0000018fab9fa8b699754458c76e92d1&src=GD_JOB_AD&t=SR&vt=w&cs=1_003695bd&cb=1716571318937&jobListingId=1009293279864&jrtk=5-pdx1-0-1hulpva9ejpbk800-b956fcaea7527859","Singapore","5001 to 10000 Employees","1890","Financial Services","Singapore"
"1009293292378","Software Engineering Intern","Software Engineering Intern Job Title Software Engineering Intern Sustainable Finance Innovation Location Singapore Duration Minimum of 3 months About Our Team We are at the forefront of sustainable finance innovation within a globally recognized corporation . Located in Singapore our team collaborates with partners in Bangkok and London embodying innovation diversity and technological expertise . Our vision is to employ technology to create a financial ecosystem that is efficient ethical and sustainable . The Opportunity As a Software Engineering Intern within the Sustainable Finance Innovation Team you will have the opportunity to work on cuttingedge projects at the intersection of technology and sustainable finance . This role offers exposure to a diverse tech stack and the chance to apply your skills in a realworld setting . What You will Do Work with a LeadingEdge Tech Stack Gain exposure to technologies including Python or JavaScript Terraform AWS and serverless architectures like DynamoDB API Gateway and Lambda functions . Lead a Capstone Project Oversee a capstone project from start to finish with guidance from senior team members applying your technical skills to a tangible project within the realm of sustainable finance . Deep Dive into Sustainable Finance Acquire deep insights into sustainable finance positioning yourself at the forefront of this transformative industry . Experience Multicultural Collaboration Be part of a vibrant multicultural team benefiting from the diversity of thoughts and innovations . Receive Mentorship Enjoy mentorship from industry leaders eager to share their knowledge and contribute to your professional growth . Who We are Looking For Enrolled in a degree in Computer Science Engineering or a related technical field with a strong interest in applying technology to societal challenges . Curious about the potential of technology to drive positive change and keen to explore new solutions . Possesses strong problemsolving skills with the ability to develop creative and effective solutions to complex challenges . An effective communicator capable of working well within a diverse team environment . Adaptable and open to learning ready to engage in a vibrant and evolving setting . Required Skills and Experience Programming Languages Proficiency in Python or JavaScript . Familiarity with both is a plus . Web Development Experience with React or a strong interest in learning it . API Development An understanding of RESTful APIs with experience in API Gateway and Lambda functions considered a plus . Serverless and Cloud Technologies Familiarity with AWS and an understanding of serverless architecture is considered a plus . Microservices Architecture An understanding of microservices architecture principles beneficial for designing and developing scalable and maintainable applications . Software Development Practices A foundation in software development principles including version control e . g . Git and CICD pipelines . Experience with containerization tools like Docker is a plus . Database Technologies Knowledge of or willingness to learn database technologies especially DynamoDB or experience with other NoSQL databases . Ability to work both independently and collaboratively . What is in It for You A Pathway to Your Future This internship is a gateway to the dynamic world of sustainable finance equipping you with essential skills and knowledge for a thriving career in technology . A Diverse and Inclusive Experience Join a team where diversity and inclusion are celebrated and your unique perspectives are valued . Personalized Mentorship Receive direct mentorship from experienced professionals dedicated to your learning and professional development . How to Apply Please submit your resume optionally including any relevant projects or experiences that highlight your skills and interests in technologys role in sustainable finance . We are committed to fostering an inclusive and diverse workplace and encourage applications from all technical backgrounds . Application Deadline 30 April 2024 Dive into the transformative world of sustainable finance with us . We are eager to see the unique contributions you will bring to our team LSEG is a leading global financial markets infrastructure and data provider . Our purpose is driving financial stability empowering economies and enabling customers to create sustainable growth . Our purpose is the foundation on which our culture is built . Our values of Integrity Partnership Excellence and Change underpin our purpose and set the standard for everything we do every day . They go to the heart of who we are and guide our decision making and everyday actions . Working with us means that you will be part of a dynamic organisation of 25000 people across 65 countries . However we will value your individuality and enable you to bring your true self to work so you can help enrich our diverse workforce . You will be part of a collaborative and creative culture where we encourage new ideas and are committed to sustainability across our global business . You will experience the critical role we have in helping to reengineer the financial ecosystem to support and drive sustainable economic growth . Together we are aiming to achieve this growth by accelerating the just transition to net zero enabling growth of the green economy and creating inclusive economic opportunity . LSEG offers a range of tailored benefits and support including healthcare retirement planning paid volunteering days and wellbeing initiatives . We are proud to be an equal opportunities employer . This means that we do not discriminate on the basis of anyones race religion colour national origin gender sexual orientation gender identity gender expression age marital status veteran status pregnancy or disability or any other basis protected under applicable law . Conforming with applicable law we can reasonably accommodate applicants and employees religious practices and beliefs as well as mental health or physical disability needs . Please take a moment to read this privacy notice carefully as it describes what personal information London Stock Exchange Group LSEG we may hold about you what it is used for and how it is obtained your rights and how to contact us as a data subject . If you are submitting as a Recruitment Agency Partner it is essential and your responsibility to ensure that candidates applying to LSEG are aware of this privacy notice . Job ID R0084108","11860","London Stock Exchange Group","https://www.glassdoor.com/partner/jobListing.htm?pos=101&ao=1136043&s=58&guid=0000018fab9fa8b699754458c76e92d1&src=GD_JOB_AD&t=SR&vt=w&cs=1_b1da3f69&cb=1716571318937&jobListingId=1009293292378&jrtk=5-pdx1-0-1hulpva9ejpbk800-dccd334d3bb9c465","Singapore","10000+ Employees","1698","Financial Services","Singapore"
"1009293300818","Software Engineer","Software Engineer Prudentials purpose is to be partners for every life and protectors for every future . Our purpose encourages everything we do by creating a culture in which diversity is celebrated and inclusion assured for our people customers and partners . We provide a platform for our people to do their best work and make an impact to the business and we support our peoples career ambitions . We pledge to make Prudential a place where you can Connect Grow and Succeed . In this role you will design develop and provide support for Point of Sales platforms for Prudential Singapore to power Sales Process done by life Insurance Distribution channels . This is a handson software engineering software engineering leadership role . We are looking for an Engineering enthusiast who is passionate around solving business problems through innovation engineering practices . This role requires the candidate to have depth of knowledge and expertise that can be applied to all aspects of the software development lifecycle as well as partner continuously with multiple stakeholders regularly to stay focused on common goals . As part of this dynamic role you will work closely with business units and other IT teams to deliver leading edge technology to enable digital capabilities of Prudential Singapore . Job Descriptions Deliver technical excellence Contribute to the translation of business requirements into wellarchitected software solutions Participate and at times facilitate technical discussions with the team Adhere and contribute to platform related technical standards and processes Develops data integration migration and deployment strategies Deliver applications in accordance to relevant IT policies and procedures Adhere to companys Software Development Life Cycle SDLC . Identify and solve complex problems collaboratively Contribute to the technical training development of the team Who we are looking for Technical Skills Strong background in designdevelopment and support of large webbased systems complete software product lifecycle exposure Strong culture on Software Testing Unit Test TDD BDD 68 years of Back End development experience Experience and affinity with Agile development methodologies Scrum Kanban XPeXtreme Programming Complexity estimation planning poker Strong background in designdevelopment of JavaSpring Boot based systems Strong understanding of environment management release management code versioning engineering best practices and deployment methodologies Must haveExperience with Java 8+ RESTful APIs and Microservices development Spring Boot Spring Cloud TDDBDD JUnit Mockito and cucumber RDBMS NoSQL Event based systems Development Reactive development Event Streams Code Version Control tools GIT bitbucket DevOps CICD Docker Kubernetes Cloud platform AzureAPIM Good understanding of Linux VM Personal Traits Excellent problem analysis skills . Innovative and creative in developing solutions Strong verbal and written communication skills Strong emphasis on teamwork and collaboration to deliver business value Passionate about delivery of quality software Strong sense of drive and commitment Strong sense of personal accountability Works well in a dynamic environment Education Bachelors in computer science Computer Engineering or equivalenthigher Language Fluent written and spoken English Prudential is an equal opportunity employer . We provide equality of opportunity of benefits for all who apply and who perform work for our organisation irrespective of sex race age ethnic origin educational social and cultural background marital status pregnancy and maternity religion or belief disability or parttime fixedterm work or any other status protected by applicable law . We encourage the same standards from our recruitment and thirdparty suppliers taking into account the context of grade job and location . We also allow for reasonable adjustments to support people with individual physical or mental health requirements . Job ID 24020141","10215","Prudential plc","https://www.glassdoor.com/partner/jobListing.htm?pos=103&ao=1136043&s=58&guid=0000018fab9fa8b699754458c76e92d1&src=GD_JOB_AD&t=SR&vt=w&cs=1_1543a4e9&cb=1716571318938&jobListingId=1009293300818&jrtk=5-pdx1-0-1hulpva9ejpbk800-dd357b78007d953a","Singapore","10000+ Employees","1848","Insurance","Singapore"
"1009293285249","Solution Architect","Solution Architect The job in short As a Solution Architect it is your job to ascertain that envisaged solutions become reality . Taking this clientfacing role you are equally comfortable in deepdive technical workshops and in boardlevel sales presentations . Having earned your stripes in designing webbased architectures you have no problem finding the scope in largescale complex projects . To the development team you are the vital mainstay during processes of implementation . To customers and partners you are the expert liaison with a keen feel for their needs . So besides being a great technician you are also a considerate companion who delivers remarkable results on a continuous basis . Meet the job You will be part of the development team in which you will fulfill a leading role only gained by excellent performance . Talking highly specific technical details as well as discussing general business outcomes you comfortably translate customer requirements into a distinguished design . You dedicate yourself to security deployment performance caching sizing scalability and serviceability . You know our projects are to be delivered according to briefing time and budget but you also know our technicians need their space to build the solutions you have defined . By creating structure and clear explanations you provide guidance and oversight to your team . Also part of the job is creating technical architecture documentation working with the QA lead to define the test strategy leading DevOps to define and implement CICD pipelines ensuring that implementations meet nonfunctional requirements and you will be traveling a significant amount of the time spending time onsite during the inception phase and when providing training and workshops . How about you Your knowledge of the Java platform exceeds our expectations You have experience with Spring Maven and Jenkins You have a demonstrable understanding of Service Oriented Architectures SOA as well as MicroServices Architecture You know JavaScript frameworks MVC patterns and principles of REST APIs ideally including RAML andor OpenAPI are second nature to you When we ask you about architectural frameworks you easily dig up your knowledge and best practices You have professionally worked with Enterprise Integration Patterns and Frameworks And let us not forget your broad operational knowledge of application servers databases load balancers and other infrastructure components required to deploy web applications in a highly available and scalable environment Last but not least you have excellent communication and presentation skills in English . We will be extra happy if you You have created solutions for financial services especially banking You have experience with PortalWeb Content Management You are familiar with architectural patterns such as Microservices CQRS event sourcing You have experience with server virtualization and containers technology such as Docker VMWare HyperV You have professionally used Integration Platforms API Gateway etc . Join our team and be a part of a certified Great Place to Work We are proud to have achieved this recognition in India Australia Singapore and Vietnam . As a company we are committed to providing a positive and inclusive work environment where our employees can thrive . So what are you waiting for Come be a part of our culture and grow with us . Job ID 5887728","117266","Backbase","https://www.glassdoor.com/partner/jobListing.htm?pos=104&ao=1136043&s=58&guid=0000018fab9fa8b699754458c76e92d1&src=GD_JOB_AD&t=SR&vt=w&cs=1_aa35fd99&cb=1716571318938&jobListingId=1009293285249&jrtk=5-pdx1-0-1hulpva9ejpbk800-a7fcdcb477740924","Singapore","1001 to 5000 Employees","2003","Information Technology","Singapore"
"1009293278673","Senior Software Development Engineer","Senior Software Development Engineer Our Purpose We work to connect and power an inclusive digital economy that benefits everyone everywhere by making transactions safe simple smart and accessible . Using secure data and networks partnerships and passion our innovations and solutions help individuals financial institutions governments and businesses realize their greatest potential . Our decency quotient or DQ drives our culture and everything we do inside and outside of our company . We cultivate a culture of inclusion for all employees that respects their individual strengths views and experiences . We believe that our differences enable us to be a better team one that makes better decisions drives innovation and delivers better business results . Title and Summary Senior Software Development Engineer Mastercard Labs Mastercards global research and development division is looking for brilliant and passionate software engineers to join its global RD team in Singapore . In this role you will be a key member of a highly agile team of engineers within Mastercard Labs working to build product prototypes pilots as well as market tests . This is an opportunity to become part of a world class engineering team focused on trending topics and issues globally . The job offers opportunities to create innovative paymentcommerce solutions experiment cutting edge technologies and develop prototypepilot projects . Are you a talented software developer with a passion for technology development and innovation Do you have a strong track record in rapid prototyping and delivering new and exciting projects and learning new technologies e . g . AR VR 5G Autonomous IoT AI NLP Unattended Retail Blockchain Provenance Do you have a passion for product design and technology innovation and have a high energy cando attitude and strong sense of ownership desire to succeed Role Design Code Document and Test software that meet quality objectives Scalable Extensible FaultTolerant Automated Unit Integration Tests Test Coverage etc . Must work both independently and part of Labs Team ensuring that actions are aligned with Group Company strategy . Must have thorough understanding of 4 party payment model . Knowledge in EMV card presentcard not presenttokenization standards preferred . Solution Oriented Find and implement the best fit solution to address the requirement on time . Expertise in Agile tools like JIRA Kanban and Confluence Wiki required . Assist defining processes and choice of development tools to be used across the group . Interpret technical specifications to produce detailed design that can not only cater to them but also be extensible . Define functional and performance test criteria for the design . Collaborate in architectural decisions and identify bestofbreed methods tools APIs and assess technical fit . Provide task estimates level of complexity assessment inputs that enable better scheduling of the sprint . Pass on knowledge of various technologies to other team members and to other functions . Willingness to work outside of core hours on an ongoing basis to ensure aggressive deadlines are met with the highest standards possible . All About You Skills Abilities Strong analytical and problemsolving skills . Ability to quickly learn and implement new technologies frameworks and tools and support multiple concurrent activities and to interface with external internal resources working as a member of a geographically distributed project team . Highenergy detailoriented proactive and able to function under pressure in an independent environment along with a high degree of initiative and selfmotivation to drive results . Working knowledge and understanding of Agile Concepts and Scrum Methodologies is required . Strong communication skills both verbal and written and strong relationship collaboration skills and organizational skills . Key Technology Areas Agile software development Backend API design Microservices Spring Boot Reactive Frontend CSS HTML5 JavaScript Angular React Automated software testing eg Serenity Selenium Protractor Mobile iOS Android Database Postgres MySQL MongoDB Others EMV technology JavaCard Hadoop Corporate Security Responsibility All activities involving access to Mastercard assets information and networks comes with an inherent risk to the organization and therefore it is expected that every person working for or on behalf of Mastercard is responsible for information security and must Abide by Mastercards security policies and practices Ensure the confidentiality and integrity of the information being accessed Report any suspected information security violation or breach and Complete all periodic mandatory security trainings in accordance with Mastercards guidelines . Job ID R218631","3677","Mastercard, Inc.","https://www.glassdoor.com/partner/jobListing.htm?pos=105&ao=1136043&s=58&guid=0000018fab9fa8b699754458c76e92d1&src=GD_JOB_AD&t=SR&vt=w&cs=1_b704f498&cb=1716571318938&jobListingId=1009293278673&jrtk=5-pdx1-0-1hulpva9ejpbk800-ad96d462fdd7e21e","Singapore","10000+ Employees","1966","Financial Services","Singapore"
