"job_id","job_title","job_description","company_id","company_name","job_url","job_location","company_size","founded_year","company_sector","country"
"1009161055641","Solution Architect Cloud","Experiences in the technologies and products proposed in the tender Strong knowledge of new or latest technology platform and practices including Microsoft . NET technologies or equivalent microservices architecture cloud technology and software development best practices Highly technical and analytical possess system thinking skill and the ability to visualize how different parts interact with the whole Able to communicate and articulate clearly to Senior Management and Able to support technical decisions with rationale or data points . Possess initiative and disposition with a strong commitment and orientation towards results and high quality standards Job Types Fulltime Permanent Contract Schedule Day shift Monday to Friday Work Location In person","238834","ITCAN Pte Ltd","https://www.glassdoor.com/partner/jobListing.htm?pos=724&ao=1136043&s=58&guid=0000018fabc269a295560a53c358a44a&src=GD_JOB_AD&t=SR&vt=w&ea=1&cs=1_72b5e256&cb=1716573596467&jobListingId=1009161055641&jrtk=5-pdx1-0-1huls4qg5jr72800-f9698922e6b6ecee","Singapore","1001 to 5000 Employees","2004","Information Technology","Singapore"
"1009159176343","Associate Director SW Engineering ","Date 2 May 2024 Location UNIV ADMIN Kent Ridge Campus SG Company National University of Singapore About NUS IT NUS Information Technology is the cornerstone to providing reliable highperformance and secure IT solutions and effective IT governance for the campus . Here at NUS IT we aim to transform NUS into a borderless computing community providing knowledge at its fingertips by enhancing the use of effective applications and services for teaching and learning . We drive a culture that is forwardlooking . With a strong passion for IT our people are always striving to improve push boundaries and innovate with a cando attitude . We embrace collaboration open communication and knowledge sharing . If you see yourself thriving in a dynamic environment and breaking new grounds with innovative ideas you will find yourself at home in NUS IT . As part of our team you can look forward an empowered work environment that allows you to take charge of your own career path . We provide competitive remuneration as well as flexible work arrangements to enable your growth and development . We pride ourselves on our diverse workforce and are committed to transforming NUS into a leading global University shaping the future . httpsnusit . nus . edu . sg Job Purpose We are seeking an experienced Application Development Manager to oversee one or more software development teams in NUS . This role will report into the Senior Associate Director SW Engineering role . The role will be responsible for leading and guiding teams in the development of highquality software products ensuring they meet business needs and align with NUS strategic goals . The role will also ensure implementation and adherence to best practices across all stages of the software development lifecycle including requirements analysis design coding testing deployment and maintenance . This is a handson leadership role and the candidate should be still be on active handson development . At the outset this role will lead 2 projects 1 . Leading an existing team on NUSChat . This is similar to ChatGPT but with Retrieval Augmented Generation against NUS data . 2 . Forming a new team to develop common API services used across the various NUS IT functional areas Duties and Responsibilities Technical Expertise o Provide technical guidance and expertise to teams helping to solve complex technical challenges . o Stay abreast of emerging technologies and industry trends to drive innovation within the company . o Ensure adherence to best practices in coding testing and maintenance Leadership and Team Management o Lead and mentor multiple software development teams fostering a culture of innovation collaboration and excellence . o Develop and implement strategies to enhance team performance and productivity . o Foster collaboration and highperformance culture within the team . Delivery Management Ensure the timely and highquality delivery of products aligning with project objectives scope and timelines . Technical Architecture Collaborate closely with Architecture team on system and application design Quality Assurance Implement quality assurance processes to guarantee the delivery of highquality products . Oversee testing methodologies and quality control procedures . Qualifications Bachelors or Masters degree in Computer Science Information Technology or a related field . Minimum of 8 years of experience in technical leadership roles with a strong emphasis on product engineering and technology management . Proven ability to lead and inspire crossfunctional teams promoting collaboration and achieving project objectives . Exceptional problemsolving and criticalthinking skills with a proven track record of effectively addressing technical challenges and risk mitigation . Indepth knowledge of quality assurance processes encompassing testing methodologies and quality control procedures . Demonstrated strategic thinking and planning abilities capable of aligning technical projects with organizational goals and market demands . Relevant experience in application design development and support and has completed at least 3 rounds of SDLC in application development . Technical Expertise Strong front and backend working experience Angular or React jQuery Bootstrap ASP . NET Core Mobile development Hybrid development . Working experience in Java and Flutter Hybrid Development platform is an advantage Strong Cloud application development experience using PAAS Services preferably Azure Working experience in Microservices and Containerisation technologies Deep knowledge in Relational Database Management System RDBMS such as Oracle and SQL Working experience in DevSecOps . Working Experience in Azure DevOps Jenkins Octupus Deploy Fortify SonarType SonarQube Splunk is an added advantage Working experience in Quality Engineering covering Test Management Unit Functional Performance and Load Testing . Working experience in Webdriver . IO Katalon JMeter is an added advantage Knowledge in Azure OpenAI services is an advantage More Information Location Kent Ridge Campus Organization NUS Information Technology Department Applications Applications Architecture Technology Employee Referral Eligible Job requisition ID 23988","222778","National University of Singapore","https://www.glassdoor.com/partner/jobListing.htm?pos=725&ao=1136043&s=58&guid=0000018fabc269a295560a53c358a44a&src=GD_JOB_AD&t=SR&vt=w&cs=1_7c7d8342&cb=1716573596467&jobListingId=1009159176343&jrtk=5-pdx1-0-1huls4qg5jr72800-d87f6f9e05cc027a","Singapore","10000+ Employees","1905","Education","Singapore"
"1009174393048","Change Manager Singapore","Technical Requirements Minimum 12 17 years of experience and out of which minimum 5+ years of release management using JIRA in CORE Banking . Managed Finacle 10 . x11 . x and multicountries and OPEN systems production environment . Finacle Application environment servers run in combination of IBM AIX VPC OpenShift . We need the candidate to have good knowledge in various cloud technology to support the infrastructure for Optimization . Handson Experience in Finacle Application Core Banking Server Capacity Monitoring and Optimization . Good level of command over production Infra performance monitoring and reporting tools . Good working experience in Elasticsearch Logstash GrafanaKibana AppDynamics etc . Ideal handson experience in UnixLinuxShellPython scripting . Good Handson experience in PAAS Platform as a Service and not limited to AWS Pivotal OpenShift . Sound knowledge on CICD tools flow mechanism other supporting tools with project implementation experience . Knowledge on API Message Queue handling and Caching Techniques most likely on Kafka and Redis . Working Experience on any microservice platform mostly in Banking . Ideally Site Reliability Engineering principles regarding performance reliability monitoring alerting in Production environment . Perform at the highest level of competencies like Achieving Excellence People Management Solution Driven Relationship Innovative PurposeDriven . Ability to work with stakeholders to stretch role in depthwidth . Should be wellversed with latest Finacle and technology trends . Good experience in running automation and service improvements experience . Good experience on working with multiple teams of infra and Functional team . Job Type Fulltime Pay 9000 . 00 11000 . 00 per month","3948695","Rapsys Technologies","https://www.glassdoor.com/partner/jobListing.htm?pos=726&ao=1136043&s=58&guid=0000018fabc269a295560a53c358a44a&src=GD_JOB_AD&t=SR&vt=w&ea=1&cs=1_85e9c287&cb=1716573596468&jobListingId=1009174393048&jrtk=5-pdx1-0-1huls4qg5jr72800-6a2eca75bd7682f8","Singapore","Unknown","--","--","Singapore"
"1009143348165","Microservices Java Developer"," Minimum 58 years of experience working as part of Payments Technology solution at an IT company as Microservices Developer Integration Developer Solution Architect . Must have experience of technical product development integration hub development as a developer across various SDLC phases such architecture technical design development deployment golive test dev support etc . Technical skills Java core Spring boot Kafka Kubernetes Postgres Camunda workflow MongoDB React . js Spring batch Redis cache Exposure to Banking Payments domain Exposure to Payment processing systemproductsapplications payments workflow various payments scheme and framework Exposure of payments hub such GPP OPF Icon IPF ACI UPI etc integration with bank surround ecosystem is an advantage Experience of application developer in Microservices architecture Experience of design and build of integration components Experience in data structures and algorithms design patterns and objectoriented design principles . Experience building highly scalable distributed systems . Experience of building a resilient applicationproduct with supports high throughput supports highvolumeTPS 24x7x365 Strong skills in key J2EE technologies like Core Java EJB JSP JDBC Java Mail XML JAXP JAAS JMS JSTL JTA batch Experience with various integration design patters API MQ etc . Frameworks experience SpringHibernateStrutsJasperQuartz Good knowledge of MongoDB preferred MYSQL etc . Fully conversant on Interface design Database design OOAD Experience CICD process and tools like Jenkins Ability to work in a teamindividually and handle deadlines Ability to execute the tasks as per the instructions or run books provided by the team lead or architect and basis requirements . Perform Payment Hub related build and integration activities Support system architecture design support cross business area . Ensuring project designs are compliant to architectures standards . Support Design develop implement and maintain series of programs subsystem revision and enhancement of existing apps . Support the deployment activity as per the processes defined . Ensure all the prerequisites are met prior to initiating any deployment tasks . Execute rollback procedures if required Troubleshoot incidents during deployment . Perform operational readiness tasks and ensure production acceptance criteria are met . Ensure functional and NFR requirements Capacity availability response times fault tolerance etc . are delivered as agreed Job Type Fulltime Pay 5000 . 00 7500 . 00 per month Experience Microservices Java Developer 5 years Preferred Payments 4 years Preferred Work Location In person","3948695","Rapsys Technologies","https://www.glassdoor.com/partner/jobListing.htm?pos=729&ao=1136043&s=58&guid=0000018fabc269a295560a53c358a44a&src=GD_JOB_AD&t=SR&vt=w&ea=1&cs=1_1cd55769&cb=1716573596468&jobListingId=1009143348165&jrtk=5-pdx1-0-1huls4qg5jr72800-29cb07a08584920a","Singapore","Unknown","--","--","Singapore"
"1009148933671","Senior Software Engineer Backend Role is in Amsterdam Onsite ","At Airwallex airwallex . com were building the future of global finance on one platform . Founded in 2015 in Melbourne Airwallex is the leading financial technology platform for modern businesses to grow beyond borders . With one of the worlds most powerful payments infrastructure our technology empowers businesses of all sizes to accept payments move money globally and simplify their financial operations all on one single platform . If youre excited to do the most ambitious work of your career and change the way money moves around the world join us Hiring Location Amsterdam Netherlands Onsite Hybrid Mode Airwallex is a rapidly growing fintech unicorn founded in 2015 and now flourishing at the Series E financing stage . With a global footprint across AsiaPacific Europe North America and APAC we specialize in providing diverse financial payment solutions for B2B merchants empowering businesses to operate seamlessly anywhere anytime . In this role you will In 2024 the Payments Team is seeking a Senior Software Engineer in the Amsterdam RD center . In this role you will play a key part in diverse initiatives across our international payments platform . We highly value your expertise in constructing designing and engineering payment systems whether it is a gateway acquiring issuing or equivalent . If you are not already familiar you will gain comprehensive knowledge of Visa and Mastercard payment platforms . Collaboration with the payments product team and occasional interaction with partners engineering teams are encouraged . As a vital member of our core acquiring payment team you will contribute to building the nextgeneration Payment Acceptance infrastructure with a constant focus on Merchant needs . In our Payments Team your responsibilities extend beyond delivering product features to achieving business outcomes . Your tasks will involve developing various REST services and integration components within a backend microservices architecture connecting with our React frontend . The scope of your role includes designing and implementing new capabilities aligned with our product roadmap conducting architectural reviews for current and upcoming solutions addressing tech debt and enhancing operational effectiveness . You might be a great fit if you Over 5 years of expertise in contemporary engineering methodologies emphasizing continuous integration and quality engineering . Proficient in guiding a concept from inception to implementation with a dedication to delivering meticulously tested and highquality solutions . Possesses robust computer science fundamentals with a recent focus on Java or Kotlin Spring Spring Boot technologies . Specialized in designing and constructing REST APIs adept in handling highvolume distributed systems Kafka event streams and distributed data storage systems such as Cassandra Hazelcast Oracle Coherence or similar technologies . Demonstrated proficiency in cloud platforms like GCP or AWS EC2 RDS ELB CloudFront along with exposure to containerization technologies like Docker and Kubernetes . Skilled in Javascript Typescript and wellversed in operational tooling including but not limited to New Relic StatsD Elk Datadog and Prometheus . Nicetohave Extensive experience in the development of payment gateways acquiring platforms or issuing platforms . A strong advantage includes expertise in integrating Local Payment Methods i . e . iDeal Klarna Trustly or major Cards i . e . Visa Mastercard . Airwallex is proud to be an equal opportunity employer . We value diversity and anyone seeking employment at Airwallex is considered based on merit qualifications competence and talent . We dont regard color religion race national origin sexual orientation ancestry citizenship sex marital or family status disability gender or any other legally protected status when making our hiring decisions . If you have a disability or special need that requires accommodation please let us know . Airwallex does not accept unsolicited resumes from search firmsrecruiters . Airwallex will not pay any fees to search firmsrecruiters if a candidate is submitted by a search firmrecruiter unless an agreement has been entered into with respect to specific open position s . Search firmsrecruiters submitting resumes to Airwallex on an unsolicited basis shall be deemed to accept this condition regardless of any other provision to the contrary . Location SG Singapore Type Full time Department Engineering Payments Platform","1831889","Airwallex","https://www.glassdoor.com/partner/jobListing.htm?pos=730&ao=1136043&s=58&guid=0000018fabc269a295560a53c358a44a&src=GD_JOB_AD&t=SR&vt=w&cs=1_fac23cba&cb=1716573596467&jobListingId=1009148933671&jrtk=5-pdx1-0-1huls4qg5jr72800-f4b9ff126c04ba32","Singapore","1001 to 5000 Employees","2015","Information Technology","Singapore"
"1009143759655","Private Equity Real Estate Technology Software Engineer Analyst Singapore ","Blackstone is the worlds largest alternative asset manager . We seek to create positive economic impact and longterm value for our investors the companies we invest in and the communities in which we work . We do this by using extraordinary people and flexible capital to help companies solve problems . Our 1 trillion in assets under management include investment vehicles focused on private equity real estate public debt and equity infrastructure life sciences growth equity opportunistic noninvestment grade credit real assets and secondary funds all on a global basis . Further information is available at www . blackstone . com . Follow blackstone on LinkedIn Twitter and Instagram . Blackstone Technology Innovations Blackstone Technology Innovations BXTI is the technology team at the core of each of Blackstones businesses and new growth initiatives . Serving both internal and external clients we work to build the next generation of systems that manage risk create efficiency and improve transparency within the firm and across our broad community of investors and portfolio companies . BXTI is nimble and entrepreneurial our open iterative design processes and rapid pace of development mean that everyone on the team has the opportunity to make an impact from day one . We are problem solvers who can take projects from idea to implementation . We believe in active mentoring and developing excellence . We collaborate to find the best answers for our customers and for Blackstone . We are critical to the firm maintaining its competitive edge . Job Description As a Software Engineer for Private Equity Real Estate Technology you will be part of a dynamic team of fullstack engineers in designing building deploying testing and supporting applications and related services hosted on AWS . Collaborating with business stakeholders you will drive business value while ensuring the delivery of highquality code . Youll tackle a variety of problems from scaling out infrastructure to promoting business efficiency through automating business processes . Youll devise elegant solutions to Blackstones most important problems and put your own best ideas to work in an entrepreneurial environment inside one of the worlds most successful companies . Our internal applications leverage a highly scalable microservices architecture deployed on cloudhosted containerized environment . Key technologies in our stack include NextJSReact FastAPI Python C# Terraform SQL AWS ECS AWS Lambda AWS Step Function AWS DynamoDB AWS S3 CICD tooling e . g . Jenkins and data warehouse solutions like Snowflake . Responsibilities Developing and maintaining software solutions using languages such as Python C# TypeScriptJavaScript and SQL ensuring high code quality scalability reliability and security . Creating deploying and maintaining APIs and microservices to integrate with frontend and thirdparty applications . Writing automated unit integration and deployment tests to ensure software quality . Building cloudnative solutions using AWS Terraform and Docker focusing on scalability and robustness . Utilizing standard CICD tooling such as GitLab and Jenkins to automate deployment of application code across different environments . Building supporting and integrating with applications microservices and data pipelines on various platforms . Embracing an innersource approach and culture to enhance collaboration within the organization . Collaborating with crossfunctional teams to design and implement new features and applications following Agile methodologies and utilizing tools like JIRA . Mentoring junior developers contributing to a positive team culture and being open to learning from senior engineers . Automating deployments using GitLab and Jenkins in coordination with Platform and DevOps engineers . Qualifications Bachelors or Masters degree in Computer Science or a related field . 1+ years of software engineering experience with proficiency in C# andor Python Experience working with databases relational andor NoSQL and cloud technologies preferably AWS is highly desirable . Knowledge of infrastructure as code tools like Terraform and containerization technologies like Docker . Understanding of Agile methodologies especially Scrum and ability to manage projects from start to finish . Deep understanding of RESTful API design development and scalable microservice architectures . Ability to develop scalable secure and maintainable code with strong objectoriented programming experience . Eager to learn excellent problemsolving abilities and a strong attention to detail . Effective communication skills both written and verbal along with the ability to work collaboratively in a team environment are essential . Selfstarter with an entrepreneurial attitude willing to teach mentor others and learn new technologies . The duties and responsibilities described here are not exhaustive and additional assignments duties or responsibilities may be required of this position . Assignments duties and responsibilities may be changed at any time with or without notice by Blackstone in its sole discretion . Blackstone is committed to providing equal employment opportunities to all employees and applicants for employment without regard to race color creed religion sex pregnancy national origin ancestry citizenship status age marital or partnership status sexual orientation gender identity or expression disability genetic predisposition veteran or military status status as a victim of domestic violence a sex offense or stalking or any other class or status in accordance with applicable federal state and local laws . This policy applies to all terms and conditions of employment including but not limited to hiring placement promotion termination transfer leave of absence compensation and training . All Blackstone employees including but not limited to recruiting personnel and hiring managers are required to abide by this policy . If you need a reasonable accommodation to complete your application please contact Human Resources at 2125835000 US +44 0 20 7451 4000 EMEA or +852 3656 8600 APAC . Depending on the position you may be required to obtain certain securities licenses if you are in a client facing role andor if you are engaged in the following Attending client meetings where you are discussing Blackstone products andor and client questions Marketing Blackstone funds to new or existing clients Supervising or training securities licensed employees Structuring or creating Blackstone fundsproducts and Advising on marketing plans prepared by a sales team or developing andor contributing information for marketing materials . Note The above list is not the exhaustive list of activities requiring securities licenses and there may be roles that require review on a casebycase basis . Please speak with your Blackstone Recruiting contact with any questions . To submit your application please complete the form below . Fields marked with a red asterisk must be completed to be considered for employment although some can be answered prefer not to say . Failure to provide this information may compromise the followup of your application . When you have finished click Submit at the bottom of this form . ","7560266","Blackstone Group","https://www.glassdoor.com/partner/jobListing.htm?pos=801&ao=1136043&s=58&guid=0000018fabc566948172ebb94ded491e&src=GD_JOB_AD&t=SR&vt=w&cs=1_b0a440f0&cb=1716573792266&jobListingId=1009143759655&jrtk=5-pdx1-0-1hulsapnmjr7r800-1ea704799e7d7b8d","Singapore","1001 to 5000 Employees","--","--","Singapore"
