"job_id","job_title","job_description","company_id","company_name","job_url","job_location","company_size","founded_year","company_sector","country"
"1009264760122","Cloud Solution Architect Digital","The Lead Cloud Solutions Architect role is about architecting innovative secure and future ready digital solutions around how our customers will purchase selfserve online . In this role you will be required to understand define and implement secure solutions that are architecturally sound meet Chubbs technical guidelines and is able to meet Chubbs platform requirements . The Architect should be able to clearly articulate document communicate the technical design and requirements to both internal stakeholders and drive solution design discussions with partner architecture teams . Main Responsibilities Provide consultation and technical advice to Business development team in TPCR process for Partner onboarding . Work alongside with TPCRM team in the issue classification and remediation plans . Investigate Cloud Resources and devising strategies to improve serverutilization and reduce the cloud cost by considerable amount . Provide Expert advisory to Global Infrastructure team to improve Reliability DR capability while keeping the cloud spending in check . Lead Infrastructure Migration Azure2 . 0 for entire portfolio of Digital projects in APAC Region . Drive Building Permit process endtoend for all Studio Ecommerce EService applications involving various domain architects review approvals in APAC region . Creates innovative and practical designs that account for the endtoend technical solution of a system in line with the business strategy and objectives and within the context of Chubbs technology environment . Identify define and implement reusable assets and standards responsible for adherence to these standards and consumption of reusable assets across products and portfolios Ensure relevant technical strategies policies standards and practices are applied correctly across Technology programsprojects and products . Work across multiple projects with varied stakeholders . Set architectural direction build consensus mediate conflict and providing technical leadership and advisory services to the business . Converts business and technical requirements into technology solutions Provide architecture leadership subject matter expertise to client engagements focusing on complex innovative products and reusable assets Guide others in resolving complex issues in all aspects of a project Considers the art of the possible compares various architectural options based on feasibility and impact and proposes actionable plans Assesses and manage multiple technical challenges simultaneously Applies judgment when implementing application developmentengineering methodologies processes and practices to meet all project requirements including product design information security code maintainability and reliability Can balance what is strategically right with what is practically realistic by balancing the risk to the project product or to the firm . Should possess good product instinct and excellent project management skills to push projects over the finish line with sound planning and persistent execution Demonstrates strong analytical and technical problemsolving skills Has the ability to analyze and operate at various levels of abstraction Can lead a diverse group of project stakeholders and members towards successful delivery of a project . Receives general direction from the International Solution Architecture Leadership Team . Works with architecture leaders and peers business stakeholdersclients product owners project managers product managers engineers product analysts and business stakeholders to drive a projects progress and ensure success Has an expert understanding of cloud solution architecture . Deep understanding of Application Infrastructure and security architecture and nonfunctional aspects like Performance Scalability Reliability Availability . . . all the socalled capabilities of a system Understanding of latest cloud computing and data technologies business drivers emerging computing trends and deployment options . Expert in defining designing and developing distributed and scalable products and services including reusable domainspecific microservices on multiplatform hybrid clouds such as Microsoft Azure AWS Google Cloud Rackspace VMware or OpenStack Experience with Agile DevSecOps methodologies Excellent project management collaboration interpersonal and communication skills Strong collaborator willingness to share ideas documentation and leading practices Conceptual and analytical thinker ability to extract analyze and document complex business and technical requirementsstrategies Experience Minimum of 10+ years overall IT industry experience Minimum of 5+ years in a solution or technical architect role using service and hosting solutions such as privatepublic cloud IaaS PaaS and SaaS platforms Experience in architecting and designing technical solutions for Microsoftcentric solutions based on industry standards using Azure PaaS and SaaS capabilities . Knowledge of cloud security controls including tenant isolation encryption at rest encryption in transit key management vulnerability assessments application firewalls SIEM etc . Managed the endtoend lifecycles of a project in cloud solution architect capacity Experience with mission critical technology components with DR capabilities Leadership capability and proven ability to manage difficult stakeholders Experience supporting peer teams and their responsibilities such as infrastructure operations engineering infosecurity","150","Chubb","https://www.glassdoor.com/partner/jobListing.htm?pos=512&ao=1136043&s=58&guid=0000018fabbc47edb771f95d7a695336&src=GD_JOB_AD&t=SR&vt=w&cs=1_1927b2d6&cb=1716573194601&jobListingId=1009264760122&jrtk=5-pdx1-0-1hulroi1vkc2o801-c4c8601ae634165a","Singapore","10000+ Employees","1792","Insurance","Singapore"
"1009257693794","Backend Developer . Net Core ","Able to collaborate with stakeholders to understand business requirements and translate them into technical solutions . Experience in designing scalable and robust . NET Core applications with an eventdriven architecture . Able to lead the design and implementation of eventdriven systems using technologies like Apache Kafka RabbitMQ or Azure Event Hubs . Experience in defining event schemas topics and producersconsumers . Handson experience in software development actively participating in coding debugging and code reviews . Able to mentor and guide development teams in best practices for . NET Core C# k8s and eventdriven design . Able to architect and oversee the development of microservicesbased solutions within the . NET Core ecosystem and ensure proper service communication and orchestration . Handson experience in integrating systems and designing APIs to facilitate data exchange between services and ensure APIs are welldocumented and secure . Experience in addressing performance and scalability challenges optimizing . NET Core applications for high throughput and low latency . Able to collaborate with DevOps teams to ensure seamless deployment and management of solutions in Cloud environments such as AWS Azure or Google Cloud . Good in establishing coding standards architectural guidelines and best practices for the development team . Job Types Fulltime Permanent Contract Benefits Professional development Schedule Day shift Monday to Friday","238834","ITCAN Pte Ltd","https://www.glassdoor.com/partner/jobListing.htm?pos=513&ao=1136043&s=58&guid=0000018fabbc47edb771f95d7a695336&src=GD_JOB_AD&t=SR&vt=w&ea=1&cs=1_dc1b8932&cb=1716573194602&jobListingId=1009257693794&jrtk=5-pdx1-0-1hulroi1vkc2o801-6eb70503b6511159","Singapore","1001 to 5000 Employees","2004","Information Technology","Singapore"
"1009262760890","Software Engineer NodeJS or Golang ","Activate Interactive Pte Ltd Activate is a leading technology consultancy headquartered in Singapore with a presence in Malaysia and Indonesia . Our clients are empowered with quality costeffective and impactful endtoend application development like mobile and web applications and cloud technology that remove technology roadblocks and increase their business efficiency . We believe in positively impacting the lives of people around us and the environment we live in through the use of technology . Hence we are committed to providing a conducive environment for all employees to realise their full potential who in turn have the opportunity to continuously drive innovation . We are searching for our next team members to join our growing team . If you love the idea of being part of a growing company with exciting prospects in mobile and web technologies that create positive impact on peoples lives then we would love to hear from you . CoDevelopment Business Unit is looking for Software Engineer NodeJS andor Golang Internal Code A24012 What will you do We develop the Smart Nation infrastructure and applications and facilitate collaboration with citizens and businesses to codevelop technologies . Join us as we support Singapores vision of building a Smart Nation a nation of possibilities empowered through infocommunications technology and related engineering . Our objective is to catapult our government infrastructure into the new digital era with faster time to market operational agility automated deployment and scalability . We are an agile development and operations house that is bold agile and collaborative . The team is responsible for designing prototyping building and operating different products and services . As a Software Engineer BackEnd you will help to level up the teams competency with your valuable past experiences . Experiences of failure are just as important as those of success . You will drive implement deploy maintain and operate products or key components of your products . You will work closely with different teams to deliver the best possible and impactful Solutions . If you are looking for opportunities to collaborate with leading industry experts and be surrounded by highly motivated and talented peers we welcome you to join us . Make a difference by taking up the key role and be part of the passionate and inspirational team . Ownership over feature design and implementation with a focus on sound technical choices and maintainability . At times this would be in collaboration with other software engineers . Requirements What are we looking for 35 years of relevant experience Proficient in at least one programming language such as JavaScriptTypeScript Golang Java Python or C++ Candidates with Nodejs or Golang experience are preferred Familiar with common Internet technologies including but not limited to backend database MQ caching microservice architectures andor cloud infrastructure . Contribute in technical discussions and solutioning sessions . Possess good coding and documentation habits pay attention to code style familiar with basic design patterns and principles and continuously focus and optimize projects Autonomy to drive the direction of the product Chance to work on creating developer tooling systems from the ground up from research all the way to implementation . Chance to work with different development teams while enabling them to be more productive at the same time Excellent teamwork and communication skills communicating technically complex ideas to nontechnical people effectively is a plus Having a growth mindset and willing to share knowledge to grow together with the team Enjoy making data driven decisions Understand that problems can be solved in different ways sometimes not with engineering understand how these solutions can and should be evaluated . Willing to learn and own fullstack Experience in frontend technologies HTML CSS and JSTS as well as any web framework React Angular Vue Experience in backend JavaScript Node . js TypeScript or other backend frameworks Experience with automated testing Experience with deployments cloud infrastructure such as AWS Azure or Google Cloud Would be a plus if you have Experience in frontend technologies HTML CSS and JSTS as well as any web framework React Angular Vue Experience in backend JavaScript Node . js TypeScript or other backend frameworks Experience with automated testing Experience with deployments cloud infrastructure such as AWS Azure or Google Cloud A Pass in ICT Assessment Certification for Solution Architect or Software Developer by NUSISS is strongly preferred . Benefits What do we offer in return Fun working environment Employee Wellness Program Does it sound like something you are interested in exploring further Please be in touch with our team for an initial chat at chiactivate . sg Activate Interactive Singapore is an equal opportunity employer . Employment decisions will be based on merit qualifications and abilities . Activate Interactive Pte Ltd does not discriminate in employment opportunities or practices on the basis of race colour religion gender sexuality national origin age disability marital status or any other characteristics protected by law . Protecting your privacy and the security of your data are longstanding top priorities for Activate Interactive Pte Ltd . Your personal data will be processed for the purposes of managing Activate Interactive Pte Ltds recruitment related activities which include setting up and conducting interviews and tests for applicants evaluating and assessing the results and as is otherwise needed in the recruitment and hiring processes . Please consult our Privacy Notice httpswww . activate . sgprivacypolicy to know more about how we collect use and transfer the personal data of our candidates . Here you can find how you can request for access correction andor withdrawal of your Personal Data . ","1650720","Activate Interactive Pte Ltd","https://www.glassdoor.com/partner/jobListing.htm?pos=514&ao=1136043&s=58&guid=0000018fabbc47edb771f95d7a695336&src=GD_JOB_AD&t=SR&vt=w&ea=1&cs=1_76de3e37&cb=1716573194602&jobListingId=1009262760890&jrtk=5-pdx1-0-1hulroi1vkc2o801-fe632788606f2122","Singapore","51 to 200 Employees","1997","Information Technology","Singapore"
"1009258028480","Java Developer","Responsibilities Analyze design and develop Microservices applications using tools such as Docker Kubernetes Spring boot SQL Ensure coded systems is align with business requirements Ensure the quality of software design and applications Collaborate and work closely with other team members and stakeholders Regularly communicate with all key stakeholders and provide updates on status SkillsRequirement Diploma Degree in IT Computer Science Engineering or equivalent Have 5 years of handson experience in application development Strong in JAVA J2EE Core Java LINUXUNIX databases on Banking Finance Insurance industry Good experience in using Microservices and Spring boot . Good in messaging technologies such as JMS Kafka ActiveMQ RabbitMQ . Familiar and experienced with containers Docker Kubernetes etc","4226090","INDEX CAREER CONSULTANTS PTE. LTD.","https://www.glassdoor.com/partner/jobListing.htm?pos=515&ao=1136043&s=58&guid=0000018fabbc47edb771f95d7a695336&src=GD_JOB_AD&t=SR&vt=w&cs=1_8f7be5f7&cb=1716573194600&jobListingId=1009258028480&jrtk=5-pdx1-0-1hulroi1vkc2o801-8a600724053885be","Singapore","Unknown","--","--","Singapore"
"1009258028545","Application Development Manager Technical Architect ","At least 8 years of software development experience with ability to solve complex IT issues . Good knowledge of strategic IT solutions and handson experience in software development . A strong understanding of recent Java language features . Good knowledge of algorithms and data structures with strong fundamentals in complexity analysis Strong ability to analyze code understand execution flow debug even without access to a debugger At least 5 years of experience with Sql Server or any other RDBM Understanding of CICD pipelines and toolings Java 8 development with multithreading principles good knowledge of Java data structure and objects . Apache StormFlinkSpark Experience with cloud computing and cloud technologies would be an added advantage Parrallel processing of the message transformation pipeline to fPML Json and keyvalue Experience of working with large scale Sql Server database Kafka publishingdistribution primarily + MQ optional Microservices based technology . Defining APIs and registering APIs in the service catalogue . Systematic dictionarization of dataservices APIs and functions taxonomy of attributes in intefaces Swagger Experence in Performance Tuning and optimizations Experience with Jiraother issue tracking system . Agile methodology ScrumKanban ","2567157","TRINITY CONSULTING SERVICES PTE. LTD.","https://www.glassdoor.com/partner/jobListing.htm?pos=516&ao=1136043&s=58&guid=0000018fabbc47edb771f95d7a695336&src=GD_JOB_AD&t=SR&vt=w&cs=1_ee93121e&cb=1716573194601&jobListingId=1009258028545&jrtk=5-pdx1-0-1hulroi1vkc2o801-ecacfd560f54ae33","Singapore","1 to 50 Employees","2015","Information Technology","Singapore"
"1009264729113","Cloud Solution Architect Digital","The Lead Cloud Solutions Architect role is about architecting innovative secure and future ready digital solutions around how our customers will purchase selfserve online . In this role you will be required to understand define and implement secure solutions that are architecturally sound meet Chubbs technical guidelines and is able to meet Chubbs platform requirements . The Architect should be able to clearly articulate document communicate the technical design and requirements to both internal stakeholders and drive solution design discussions with partner architecture teams . Main Responsibilities Provide consultation and technical advice to Business development team in TPCR process for Partner onboarding . Work alongside with TPCRM team in the issue classification and remediation plans . Investigate Cloud Resources and devising strategies to improve serverutilization and reduce the cloud cost by considerable amount . Provide Expert advisory to Global Infrastructure team to improve Reliability DR capability while keeping the cloud spending in check . Lead Infrastructure Migration Azure2 . 0 for entire portfolio of Digital projects in APAC Region . Drive Building Permit process endtoend for all Studio Ecommerce EService applications involving various domain architects review approvals in APAC region . Creates innovative and practical designs that account for the endtoend technical solution of a system in line with the business strategy and objectives and within the context of Chubbs technology environment . Identify define and implement reusable assets and standards responsible for adherence to these standards and consumption of reusable assets across products and portfolios Ensure relevant technical strategies policies standards and practices are applied correctly across Technology programsprojects and products . Work across multiple projects with varied stakeholders . Set architectural direction build consensus mediate conflict and providing technical leadership and advisory services to the business . Converts business and technical requirements into technology solutions Provide architecture leadership subject matter expertise to client engagements focusing on complex innovative products and reusable assets Guide others in resolving complex issues in all aspects of a project Considers the art of the possible compares various architectural options based on feasibility and impact and proposes actionable plans Assesses and manage multiple technical challenges simultaneously Applies judgment when implementing application developmentengineering methodologies processes and practices to meet all project requirements including product design information security code maintainability and reliability Can balance what is strategically right with what is practically realistic by balancing the risk to the project product or to the firm . Should possess good product instinct and excellent project management skills to push projects over the finish line with sound planning and persistent execution Demonstrates strong analytical and technical problemsolving skills Has the ability to analyze and operate at various levels of abstraction Can lead a diverse group of project stakeholders and members towards successful delivery of a project . Receives general direction from the International Solution Architecture Leadership Team . Works with architecture leaders and peers business stakeholdersclients product owners project managers product managers engineers product analysts and business stakeholders to drive a projects progress and ensure success Has an expert understanding of cloud solution architecture . Deep understanding of Application Infrastructure and security architecture and nonfunctional aspects like Performance Scalability Reliability Availability . . . all the socalled capabilities of a system Understanding of latest cloud computing and data technologies business drivers emerging computing trends and deployment options . Expert in defining designing and developing distributed and scalable products and services including reusable domainspecific microservices on multiplatform hybrid clouds such as Microsoft Azure AWS Google Cloud Rackspace VMware or OpenStack Experience with Agile DevSecOps methodologies Excellent project management collaboration interpersonal and communication skills Strong collaborator willingness to share ideas documentation and leading practices Conceptual and analytical thinker ability to extract analyze and document complex business and technical requirementsstrategies","14569","Combined Insurance","https://www.glassdoor.com/partner/jobListing.htm?pos=517&ao=1136043&s=58&guid=0000018fabbc47edb771f95d7a695336&src=GD_JOB_AD&t=SR&vt=w&cs=1_260da6ff&cb=1716573194601&jobListingId=1009264729113&jrtk=5-pdx1-0-1hulroi1vkc2o801-046d9d27a4ec4d0c","Singapore","Unknown","1922","Insurance","Singapore"
