"job_id","job_title","job_description","company_id","company_name","job_url","job_location","company_size","founded_year","company_sector","country"
"1009276358477","Go Software Developer","Introduction to GoNetZero Who we are In November 2022 GoNetZero was officially launched at COP27 in Egypt . We are a global decarbonisation solution provider headquartered in Singapore . We support customers on their endtoend decarbonisation journey from helping them acquire RECs carbon credits and using blockchain technology and data driven insights to assist in energy asset management . Who we are looking for GoNetZero caters to businesses of all sizes and across various industries . Our solutions are scalable and adaptable to meet the unique needs and challenges of each customer . As a highgrowth business looking to expand internationally we are looking for candidates who are entrepreneurial selfdriven selfstarters and interested in creating a lasting impact in the climate technology space . As a rapidly scaling business we thrive on adaptability and change so if you are looking to join a fastpaced exciting new business join us We are seeking a Go Software Developer with 25 years of experience . You will play a key role in designing developing and maintaining highperformance APIs ensuring code quality and reliability . Responsibilities Design develop and maintain highquality APIs using Go programming language . Collaborate with crossfunctional teams to gather and analyze requirements and translate them into technical specifications . Implement and maintain CICD pipelines to automate the build test and deployment processes . Utilize agile practices to deliver highquality software solutions within scheduled timelines . Implement and maintain RESTful GraphQL APIs adhering to best practices and industry standards . Work with JSON XML and other data formats to handle data interchange between systems . Utilize relational databases such as PostgreSQL to store and manage data efficiently . Deploy and manage applications on cloud infrastructure platforms like Azure AWS or GCP . Conduct code reviews identify areas for improvement and implement best practices for clean code and software development . Requirements Bachelors degree in Computer Science or related field . 25 years of Go development experience . Proficiency in Git and CICD pipelines . Strong grasp of RESTful and GraphQL API principles . Experience with relational databases and cloud platforms . Knowledge of TDD and clean code principles . Excellent problemsolving and communication skills . Preferred Qualifications Familiarity with microservices and containerization tools . Experience with scripting languages like Python or Bash . Knowledge of other programming languages . Relevant certifications . If you are passionate about building scalable APIs with Go apply now to shape the future of our software products and enhance customer experiences . This is a 100 inoffice position . The successful candidate must be available to work from our corporate office during regular business hours . ","0","GO NET ZERO PTE. LTD.","https://www.glassdoor.com/partner/jobListing.htm?pos=307&ao=1136043&s=58&guid=0000018faba5abf693effb049efb1d94&src=GD_JOB_AD&t=SR&vt=w&cs=1_9f1ecb8e&cb=1716571712910&jobListingId=1009276358477&jrtk=5-pdx1-0-1hulqbb2ojr6i800-3168ec708807a307","Singapore","NA","NA","NA","Singapore"
"1009276357843","Production Support","Ability to provide continuous improvement initiatives and automating recurring tasks to reduce toil for both end users and our own team . Knowledge of basic JavaObject oriented programmingMicroservicesSQLOpenShiftCICD tools Git hubJenkins Shell scriptingAWS services is desirable . A team player within the Support group and working amicably with other teams in ITT . . Able to provide quality service to business users . To develop monitoring toolsalerts to create proactive actions e . g . auto healingrecovery . To provide daytoday production support for DBS inhouse applicationsMurex . To carry out Duty Support rotations among the team members . Mostly oncall basis during off office hours in case of escalations from our level1 team . Able to work shift hours during support duty week and to carry out implementations on weekdaysweekends . To develop monitoring toolsalerts to create proactive actions . Able to take ownership of issues and follow through to closure . To assist in rolling out of new version of the application adhering to the best practices of the release management procedures . To communicate effectively and work efficiently with a group of people supporting both functionaltechnical areas . ","638017","LYNEER CORP (SINGAPORE) PTE. LTD.","https://www.glassdoor.com/partner/jobListing.htm?pos=308&ao=1136043&s=58&guid=0000018faba5abf693effb049efb1d94&src=GD_JOB_AD&t=SR&vt=w&cs=1_a0cdb4b9&cb=1716571712909&jobListingId=1009276357843&jrtk=5-pdx1-0-1hulqbb2ojr6i800-31406e7eba176bc7","Singapore","201 to 500 Employees","2010","Human Resources & Staffing","Singapore"
"1009281429027","Sr . Application Developer","Job Description Requirements Requirements Bachelors degree in computer science or a related field . 5+ years of experience in Java development . Experience in developing and deploying Microservices architectures using Spring Boot Spring Batch Spring Data or similar frameworks . Strong knowledge of RESTful web services and related technologies such as JSON Swagger and XML Experience in containerization technologies Docker Kubernetes . Experience in Message Oriented Middleware MoM technologies MQ and Kafka","1349413","TECHNOPALS PTE. LTD.","https://www.glassdoor.com/partner/jobListing.htm?pos=309&ao=1136043&s=58&guid=0000018faba5abf693effb049efb1d94&src=GD_JOB_AD&t=SR&vt=w&cs=1_5c6f12a0&cb=1716571712910&jobListingId=1009281429027&jrtk=5-pdx1-0-1hulqbb2ojr6i800-88a7446a96e1615b","Singapore","201 to 500 Employees","2009","Information Technology","Singapore"
"1009280581834","solution architect","Job Responsibilities Design and Develop Solutions Lead the design and development of comprehensive technology solutions that align with business goals and requirements . Architectural Oversight Provide architectural guidance and oversight to ensure solutions are scalable secure and aligned with best practices . Stakeholder Collaboration Work closely with stakeholders including business leaders IT teams and external vendors to gather requirements and translate them into technical solutions . Technical Leadership Serve as the technical lead on projects providing direction and guidance to development teams throughout the project lifecycle . System Integration Oversee the integration of new solutions with existing systems ensuring seamless interoperability and performance . Documentation Develop and maintain detailed architectural documentation including design blueprints technical specifications and integration plans . Technology Evaluation Evaluate emerging technologies and tools to determine their potential impact and applicability to the organizations needs . Risk Management Identify and mitigate technical risks throughout the project lifecycle ensuring successful delivery of solutions . Quality Assurance Ensure that solutions are tested and validated against requirements with a focus on quality and performance . Continuous Improvement Promote continuous improvement by identifying opportunities to enhance existing systems and processes . Job Requirements Education Bachelors degree in Computer Science Information Technology Engineering or a related field . Experience 8+ years of experience in IT with at least 4 years in a solution architecture role . Proven experience in designing and implementing enterprisescale solutions . Technical Skills Strong knowledge of cloud platforms such as AWS Azure or Google Cloud . Experience with microservices architecture APIs and web services . Proficiency in programming languages such as Java C# Python or similar . Familiarity with database technologies both SQL and NoSQL . Understanding of DevOps practices and tools including CICD pipelines . Certifications Certifications such as TOGAF AWS Certified Solutions Architect or Microsoft Certified Azure Solutions Architect Expert are highly desirable . Location Singapore We regret to inform you that only shortlisted candidates will be notifiedcontacted . Kelston Tan R22105162 Principal Consultant Technology M +65 8332 1194 E ketansg . drakeintl . com","109734","DRAKE INTERNATIONAL (SINGAPORE) LIMITED","https://www.glassdoor.com/partner/jobListing.htm?pos=310&ao=1136043&s=58&guid=0000018faba5abf693effb049efb1d94&src=GD_JOB_AD&t=SR&vt=w&cs=1_cfc0f8ec&cb=1716571712910&jobListingId=1009280581834&jrtk=5-pdx1-0-1hulqbb2ojr6i800-328899c409901d33","Singapore","1001 to 5000 Employees","1951","Human Resources & Staffing","Singapore"
"1009282087475","Solutions Engineer Distributed Cloud","At F5 we strive to bring a better digital world to life . Our teams empower organizations across the globe to create secure and run applications that enhance how we experience our evolving digital world . We are passionate about cybersecurity from protecting consumers from fraud to enabling companies to focus on innovation . Everything we do centers around people . That means we obsess over how to make the lives of our customers and their customers better . And it means we prioritize a diverse F5 community where each individual can thrive . Role Overview We currently have an opportunity for a talented Solutions Engineer SE to join our APCJ F5 Distributed Cloud Solutions organization . This is a sales and technical role with a focus on customerspartners and is part of the XC sales organization . The Specialist SEs primary responsibility is to support the sales team with technical skills and provide technical knowledge around F5 Distributed Cloud Solutions to our customers . To be effective an SE needs to have excellent technical skills and knowledge of both F5 Distributed Cloud Solutions and the ecosystem that we work in . Fear not we do provide training and certification to keep abreast with these critical skills The highlevel objective is to achieve the allocated sales target and sell relevant F5 solutions and products to our customers business needs in partnership with the Sales Account Manager . From our customer s perspective the SE is a trusted adviser who proactively learns and understands their technical and business challenges and can propose effective solutions to mitigate their concernsoffer gainful solutions . The F5 SE not only presents the technical features but also articulates the business benefits in the Technical Value Proposition . Sounds interesting Read on What youll do Work on opportunities within the assigned regionarea of specialization and provide technical expertise . Be an advocate and thought leader for the F5 Distributed Cloud Solutions by building trust and proven competence in our solutions . Collaborate with other solution engineers and internal business leaders to share ideas identify common customer pain points and trends and identify appropriate F5 solutions . How youll do it Knowledge of cloud native solutions microservicescontainers automation and orchestration solutions Advocate F5 Distributed Cloud Solutions Applying business and technology skills with structured methodologies to deliver solutions to the customer both to technical and business leads Build a high level of trust and credibility with the field peers partners and end customers What youll bring Experience in Cloud architectures in AWS Azure GCP or other public clouds and multicloud design CICD experience Experience with cloud instrumentation and configuration management tools for deployment such as GKE Kubernetes Terraform Ansible etc . Experience designing enterprise grade architectures Experience in networking and application delivery technologies BIGIP Envoy NGINX Experience in API and web communication systems and design Bring an if not me then who attitude to the role Proven track record of trust and ability to adapt to a changing environment What Youll Get Hybrid working mode Career growth and development opportunities Recognitions and Rewards Employee Assistance Program Competitive pay comprehensive benefits and cool perks Culture of Giving Back Dynamic Diversity Inclusion Interest Groups Apply if you believe your own unique capabilities can contribute to the success of this role and our organization #LISP5 The Job Description is intended to be a general representation of the responsibilities and requirements of the job . However the description may not be allinclusive and responsibilities and requirements are subject to change . Please note that F5 only contacts candidates through F5 email address ending with f5 . com or auto email notification from YelloWorkday ending with f5 . com or myworkday . com . Equal Employment Opportunity It is the policy of F5 to provide equal employment opportunities to all employees and employment applicants without regard to unlawful considerations of race religion color national origin sex sexual orientation gender identity or expression age sensory physical or mental disability marital status veteran or military status genetic information or any other classification protected by applicable local state or federal laws . This policy applies to all aspects of employment including but not limited to hiring job assignment compensation promotion benefits training discipline and termination . F5 offers a variety of reasonable accommodations for candidates . Requesting an accommodation is completely voluntary . F5 will assess the need for accommodations in the application process separately from those that may be needed to perform the job . Request by contacting accommodationsf5 . com . ","9222","f5","https://www.glassdoor.com/partner/jobListing.htm?pos=311&ao=1136043&s=58&guid=0000018faba5abf693effb049efb1d94&src=GD_JOB_AD&t=SR&vt=w&cs=1_b03933c4&cb=1716571712910&jobListingId=1009282087475&jrtk=5-pdx1-0-1hulqbb2ojr6i800-d2c113bad864c68e","Singapore","5001 to 10000 Employees","1996","Information Technology","Singapore"
"1009283497203","Analyst Programmer Systems Analyst","ABOUT THE NATIONAL INSTITUTE OF EDUCATION NIE The National Institute of Education NIE Singapore is Singapores national teacher education institute and we are proud to be an integral part of the nations education service . We play a key role in the preparation of teachers and in the provision of teacher professional and school leadership development programmes . We are committed to our vision of being An Institute of Distinction Leading the Future of Education and our mission to Inspire Learning Transform Teaching and Advance Research . Read more about NIE here . NIE invites suitable candidates to join the Division of Academic Computing Information Services ACIS as an Analyst ProgrammerSystems Analyst 2year contract . The candidate should be a dynamic IT professional who is a good team player and a strong software developer . Job Description As a member of the Digital Solutions department responsible for data migration and systems integration initiatives your responsibilities include 1 Building integration solutions between various software systems to ensure seamless communication and data flow between systems to support business operations . Specifically the activities include Architect and orchestrate robust data pipelines and integration points between systems . Develop and implement integration interfaces APIs and middleware to enable data exchange between different systems e . g . core student systems learning management platforms payment gateway etc . Work with various technical teams and product vendors to understand integration requirements and ensure compatibility . Monitor and maintain integration solutions troubleshooting and resolving any reported issues . Establish secure and compliant integration across the technology stack . 2 Performing data migration from legacy systems to new COTS to preserve data integrity quality and consistency . Specifically the activities include Develop and execute data migration scripts and processes using appropriate tools and technologies . Collaborate with business owners to establish data mapping rules . Perform data mapping cleansing transformation validation and reconciliation to ensure data accuracy postmigration . Ensure compliance with data security and privacy policies throughout the migration process . Provide postmigration support and troubleshooting as required . 3 Project management and collaboration . Specifically the activities include Track project progress to ensure timely delivery and alignment with project requirements . Foster effective communication and collaboration with crossfunctional teams involving technical and business stakeholders . Requirements A University degree in Computer Science Information Technology Engineering or a related field . At least 2 years of experience as a software developer or in a similar role with specific exposure to data migration and systems integration with APIs . Proven expertise in data mapping transformation and scriptingprogramming languages for data migration initiatives . Strong knowledge of API design and development web services REST SOAP and middleware technologies . Knowledge of database management systems and data modelling . Familiarity working with COTS and SAAS integration and migration . Proficiency in SQL and scripting languages e . g . Python Shell scripting and integration frameworks . Quick learner who is passionate and willing to learn new languages and technologies . Experience in the Software Development Life Cycle SDLC framework and Agile software development methodology . Knowledge of cloud platforms e . g . AWS Azure and microservices architecture is a plus . Knowledge of IT security principles and data and system integration compliance . Excellent problemsolving skills and attention to detail . Excellent communication and interpersonal skills . Good selfmotivated team player with a positive attitude and flexibility in adapting to changes . Ability to work with tight deadlines and fluid requirements . Closing Date The closing date of the advertisement is 30 May 2024 . We regret that only shortlisted candidates will be notified . Other Information NIE staff can take chartered buses at their own expense from or near their home to the NIE campus . This is subject to the availability of bus routes and seats . Hiring Institution NIE","0","NTU (Nanyang Technology University- Main Office-HR)","https://www.glassdoor.com/partner/jobListing.htm?pos=312&ao=1136043&s=58&guid=0000018faba5abf693effb049efb1d94&src=GD_JOB_AD&t=SR&vt=w&cs=1_35d3856d&cb=1716571712910&jobListingId=1009283497203&jrtk=5-pdx1-0-1hulqbb2ojr6i800-07be7a1792af229d","Singapore","NA","NA","NA","Singapore"
"1009277215204","Senior Java Developer Banking Applications ","Job Description We are seeking a dynamic individual who can spearhead technological advancements while also providing robust leadership in design and architecture . Your role will involve conceptualizing proposing and implementing innovative designs ensuring the development of highquality thoroughly tested code that adheres to deadlines and coding standards . Collaboration is key as you will work closely with business analysts to clarify requirements and maintain detailed technical documentation . Additionally you will devise comprehensive test strategies in coordination with project managers and business analysts offering technical support during user acceptance tests and troubleshooting issues in production . Qualifications and Profile The ideal candidate will possess A minimum of 6 years of software development experience with at least 5 years working with Java . Proficiency in various design patterns and a strong grasp of recent Java language features including lambdas streams and futures . Sound knowledge of algorithms and data structures with a solid foundation in complexity analysis . Ability to analyze and debug code effectively even without direct access to a debugger . Experience with Maven Git and writing integration tests along with familiarity with Linux and bash . Competency in SQL or a similar SQL inspired dialect such as HQL as well as experience in cloud native architecture . Preferred qualifications include expertise in Jenkins and Ansible with exposure to DevOps culture . Issue tracking systems like Jira . The Spring framework particularly Spring Boot and Swagger for RESTful web services . Messaging technologies such as Kafka and MQ . Web development fundamentals HTML JavaScript jQuery ReactJS etc . . Containerization technologies like Docker and orchestration tools like Kubernetes . Microservices architecture and ElasticSearch . General understanding of investment banking domain capital markets and front officebackoffice environments . Interest or understanding of finance and financial markets particularly interest rate derivatives . Excellent written and verbal communication skills suitable for interaction with both team members and management . Strong analytical and problemsolving abilities . Proficiency in the software development life cycle . Appetite for staying updated with technology trends and engaging with communities . Passion for sharing expertise and nurturing the skills of junior team members . Interest in mentoring and guiding team members toward delivering highquality results . Education Requirements Bachelors degree in computer science Information Technology Programming Systems Analysis or related fields . ","3803","Capgemini","https://www.glassdoor.com/partner/jobListing.htm?pos=313&ao=1136043&s=58&guid=0000018faba5abf693effb049efb1d94&src=GD_JOB_AD&t=SR&vt=w&cs=1_cbad3514&cb=1716571712912&jobListingId=1009277215204&jrtk=5-pdx1-0-1hulqbb2ojr6i800-0b779582931966a7","Singapore","10000+ Employees","1967","Information Technology","Singapore"
"1009274267862","Software DeveloperJava","Job Responsibilities Troubleshooting system and program problems . Developing support documentation for applications and systems patches developed inhouse . Responding to support requests according to IT support policies . Maintaining the company website and intranet site . Identifying and arranging project requirements . Previous experience in application development . Job Requirements Have good experience in Java Enterprise Edition or Spring or equivalent . Development of Webbased applications using UI framework such as AngularAngularJS JQuery Struts or equivalent . Development of application using Persistence framework such as Hibernate JPA or equivalent . Development of Web services Restful services or equivalent . Relational Databases like DB2 SQL Server Oracle . Using tools for testing . IDE such as Eclipse JDeveloper Netbeans or equivalent . Spring framework . Prior knowledge and experience in DevOps processes are advantageous . Knowledge and handson experience in Microservices and containerization is a plus . Advantageous skills to have Agile software development tools and standards e . g . SCRUM Microsoft Azure Cloud technology i . e . Azure Search Services Government Commercial Cloud . Good experience in frontend web technologies and backend programming Good experience in implementing troubleshooting performance tuning of web applications Good experience in building secure and resilient internet applications will be advantageous Good written and oral communication skills with ability to collaborate across teams . Strong analytical skills and a selfstarter with ability to work independently","221001","ZENITH INFOTECH (S) PTE LTD.","https://www.glassdoor.com/partner/jobListing.htm?pos=314&ao=1136043&s=58&guid=0000018faba5abf693effb049efb1d94&src=GD_JOB_AD&t=SR&vt=w&cs=1_5654b5e2&cb=1716571712911&jobListingId=1009274267862&jrtk=5-pdx1-0-1hulqbb2ojr6i800-c5428d4eed9677a8","Singapore","201 to 500 Employees","1996","Information Technology","Singapore"
